{"configVersion":1,"generatedAt":"2026-08-17T00:00:00Z","productIdentification":"power-meter-open03","schemaVersion":"1.1","serialBuses":[{"baudRate":9600,"busId":"bus-open03","dataBits":8,"devices":[{"deviceId":"3001","deviceIdentification":"meter-open03","maxRetries":1,"points":[{"address":0,"byteOrder":"BIG_ENDIAN","dataPriority":"METERING_TOTAL","dataType":"FLOAT32","function":"HOLDING_REGISTER","offset":"0","pollGroup":"normal","propertyCode":"active-power","quantity":2,"scale":"1","wordOrder":"BIG_ENDIAN","writable":false}],"pollIntervalMs":1000,"requestTimeoutMs":1000,"unitId":1}],"parity":"NONE","rs485Mode":true,"serialPort":"/dev/easyaiot/rs485-0","stopBits":"1","transmitDelayMs":0}],"siteCode":"open03-site","siteId":"200","tenantId":"100","workloadId":"collector-open03-e2e-a"}